{
  "$schema": "https://json-schema.org/draft/2020-12/schema",
  "$id": "adoption/host-receipt.schema.json",
  "title": "Host evidence acceptance receipt",
  "description": "One receipt records one component x one host x one lifecycle stage. See docs/contributing-evidence.md and scripts/host_receipts.py, which implements these rules in stdlib code (no external JSON Schema library) and is kept in sync with this file by tests/test_host_receipts.py.",
  "type": "object",
  "additionalProperties": false,
  "required": [
    "schema_version",
    "id",
    "kind",
    "host",
    "catalog_revision",
    "component_id",
    "stage",
    "commands",
    "tool_versions",
    "observed_at_utc",
    "result",
    "claim",
    "limitations",
    "evidence_class",
    "reviews"
  ],
  "properties": {
    "schema_version": {
      "const": 1
    },
    "id": {
      "type": "string",
      "description": "<host_id>--<component_id>--<stage>--<yyyymmdd>, optionally with a '-N' (N >= 2) generation suffix for a receipt recorded with 'record --supersedes' for the same host/component/stage/date",
      "pattern": "^[a-z0-9-]+-[0-9]{8}--[A-Za-z0-9][A-Za-z0-9._/:-]*--(install|use|restart|recovery|persistence|cleanup)--[0-9]{8}(-([2-9]|[1-9][0-9]+))?$"
    },
    "supersedes": {
      "type": "string",
      "description": "id of the earlier receipt (same host/component/stage/date) this one supersedes, set by 'scripts/host_receipts.py record --supersedes'. The earlier receipt file is left untouched and its reviews are not inherited by this one.",
      "pattern": "^[a-z0-9-]+-[0-9]{8}--[A-Za-z0-9][A-Za-z0-9._/:-]*--(install|use|restart|recovery|persistence|cleanup)--[0-9]{8}(-([2-9]|[1-9][0-9]+))?$"
    },
    "kind": {
      "const": "host_acceptance"
    },
    "host": {
      "type": "object",
      "additionalProperties": false,
      "required": ["host_id", "platform_id", "os", "architecture", "second_physical_machine"],
      "properties": {
        "host_id": {
          "type": "string",
          "pattern": "^[a-z0-9-]+-[0-9]{8}$"
        },
        "platform_id": {
          "type": "string",
          "minLength": 1
        },
        "os": {
          "type": "string",
          "minLength": 1
        },
        "architecture": {
          "type": "string",
          "minLength": 1
        },
        "second_physical_machine": {
          "type": "boolean",
          "description": "false only on the catalog's authoring host"
        },
        "hardware_profile_ref": {
          "type": "string",
          "minLength": 1,
          "description": "Optional string reference into adoption/hardware-profiles.json hosts[].id, owned by another unit"
        }
      }
    },
    "catalog_revision": {
      "type": "string",
      "pattern": "^[0-9a-f]{40}$",
      "description": "Full commit SHA of the checkout used to record this receipt"
    },
    "recorded_by": {
      "description": "Who ran scripts/host_receipts.py record; an independent review must come from a different identity",
      "type": "object",
      "additionalProperties": false,
      "required": [
        "identity_sha256"
      ],
      "properties": {
        "identity_sha256": {
          "type": "string",
          "pattern": "^[0-9a-f]{64}$",
          "description": "Domain-separated sha256 of 'host-receipt-identity-v1:' + $CLAUDE_CODE_SESSION_ID, or else the normalized --identity; never the raw value"
        },
        "model": {
          "type": "string",
          "minLength": 1,
          "maxLength": 100
        }
      }
    },
    "component_id": {
      "type": "string",
      "minLength": 1,
      "description": "A manifests/stack.json components[].id or a catalogs/landscape/*.json layers[].winners[].component_id. May legitimately contain '/' (for example 'affaan-m/ECC') or ':' (for example 'candidate:cli-cli'); scripts/host_receipts.py's receipt_filename_stem() percent-escapes each to a distinct, reversible filename token ('/' -> '%2F', ':' -> '%3A', and a literal '%' itself -> '%25' first) so the receipt stays a flat file under evidence/hosts/<host_id>/. This escaping applies only to the filename, never to this field or the 'id' field."
    },
    "layer_refs": {
      "type": "array",
      "minItems": 1,
      "description": "Optional, set by 'scripts/host_receipts.py record --layer-ref CATALOG/LAYER_ID' (repeatable): the catalogs/landscape/{foundation,us-equities}.json layers whose role the commands exercise. A receipt with layer_refs counts only for rows (winners and alternatives) in those layers; without them it binds to every layer its component_id wins and verifies an alternative only when that alternative's repository is catalogued in one layer (scripts/platform_status.py in_layer_scope). record requires it at stage use for a component catalogued in more than one layer.",
      "items": {
        "type": "object",
        "additionalProperties": false,
        "required": ["catalog", "layer_id"],
        "properties": {
          "catalog": {
            "type": "string",
            "minLength": 1
          },
          "layer_id": {
            "type": "string",
            "minLength": 1
          }
        }
      }
    },
    "stage": {
      "enum": ["install", "use", "restart", "recovery", "persistence", "cleanup"]
    },
    "commands": {
      "type": "array",
      "minItems": 1,
      "items": {
        "type": "object",
        "additionalProperties": false,
        "required": ["cmd", "exit", "duration_s", "output_sha256", "output_excerpt"],
        "properties": {
          "cmd": {
            "type": "string",
            "minLength": 1
          },
          "exit": {
            "type": "integer"
          },
          "expected_exit": {
            "type": "integer",
            "description": "Optional; when present, this exit code (not 0) is the coherent pass value for this command"
          },
          "duration_s": {
            "type": "number",
            "minimum": 0
          },
          "output_sha256": {
            "type": "string",
            "pattern": "^[0-9a-f]{64}$",
            "description": "sha256 of output_excerpt, the published bytes (UTF-8; the command's output sanitized as described for output_excerpt: $HOME to ~, the user name to <user>, private content to [redacted], then cut at 400 characters). It never covers unpublished output, because a digest of text a reader can guess would confirm which name was sanitized in it. From 2026-09-29; receipts recorded before then, or by an older copy of the recorder, hash the raw output"
          },
          "output_excerpt": {
            "type": "string",
            "maxLength": 400
          }
        }
      }
    },
    "tool_versions": {
      "type": "object"
    },
    "observed_at_utc": {
      "type": "string",
      "pattern": "^[0-9]{4}-[0-9]{2}-[0-9]{2}T[0-9]{2}:[0-9]{2}:[0-9]{2}Z$"
    },
    "result": {
      "enum": ["pass", "fail", "partial", "not_runnable"]
    },
    "claim": {
      "type": "string",
      "minLength": 1
    },
    "limitations": {
      "type": "array",
      "minItems": 1,
      "items": {
        "type": "string",
        "minLength": 1
      }
    },
    "evidence_class": {
      "enum": ["native_proven", "local_integration", "synthetic"]
    },
    "qualified_models": {
      "type": "array",
      "description": "Local model weights qualified on this host's runtime (for example vllm, mlx-lm, llama.cpp), recorded with scripts/host_receipts.py record --qualified-model. Optional; distinct from tool_versions, which is the runtime component's own version.",
      "items": {
        "type": "object",
        "additionalProperties": false,
        "required": ["model_id", "revision", "runtime", "runtime_version", "bars", "result"],
        "properties": {
          "model_id": {
            "type": "string",
            "minLength": 1,
            "description": "Model identifier, e.g. a Hugging Face repo id"
          },
          "revision": {
            "type": "string",
            "minLength": 1,
            "description": "Pinned revision/commit of the model weights"
          },
          "runtime": {
            "type": "string",
            "minLength": 1,
            "description": "Serving/inference runtime, e.g. vllm, mlx-lm, llama.cpp"
          },
          "runtime_version": {
            "type": "string",
            "minLength": 1
          },
          "bars": {
            "type": "string",
            "minLength": 1,
            "maxLength": 400,
            "description": "Short text summary of the qualification bars this model met (e.g. tool-call accuracy, task pass rate)"
          },
          "result": {
            "enum": ["pass", "fail"]
          }
        }
      }
    },
    "reviews": {
      "type": "array",
      "minItems": 1,
      "description": "The recorder writes exactly one self entry; independent reviewers append theirs with scripts/host_receipts.py review",
      "items": {
        "type": "object",
        "additionalProperties": false,
        "required": ["kind", "ref", "verdict", "at_utc"],
        "properties": {
          "kind": {
            "enum": ["self", "independent_session", "codex_lane", "human"]
          },
          "ref": {
            "type": "string",
            "minLength": 1
          },
          "verdict": {
            "enum": ["agree", "disagree", "needs_changes"]
          },
          "at_utc": {
            "type": "string",
            "pattern": "^[0-9]{4}-[0-9]{2}-[0-9]{2}T[0-9]{2}:[0-9]{2}:[0-9]{2}Z$"
          },
          "reviewer": {
          "type": "object",
          "additionalProperties": false,
          "required": [
            "identity_sha256"
          ],
          "properties": {
            "identity_sha256": {
              "type": "string",
              "pattern": "^[0-9a-f]{64}$",
              "description": "Domain-separated sha256 of 'host-receipt-identity-v1:' + $CLAUDE_CODE_SESSION_ID, or else the normalized --identity; never the raw value"
            },
            "model": {
              "type": "string",
              "minLength": 1,
              "maxLength": 100
            }
          }
        }
        }
      }
    }
  }
}
