{
  "schema_version": 1,
  "id": "ns2604-currency-20261005--worktrunk--install--20261005",
  "kind": "host_acceptance",
  "host": {
    "host_id": "ns2604-currency-20261005",
    "platform_id": "linux-wsl2-x86_64",
    "os": "linux",
    "architecture": "x86_64",
    "second_physical_machine": false
  },
  "catalog_revision": "4c897418fe35a030a1188ae447eaf31c893f8eff",
  "recorded_by": {
    "identity_sha256": "02f447d7d8b8c35f8d8f004da0af082c266f2a7aea68a8ff08454896a486d178"
  },
  "component_id": "worktrunk",
  "stage": "install",
  "commands": [
    {
      "cmd": "env TMPDIR=\"$HOME/.cache/ns2604-currency/tmp\" bash evidence/artifacts/new-wsl-install-plan-20261002/install.sh --only worktrunk </dev/null",
      "exit": 0,
      "duration_s": 10.906,
      "output_sha256": "308dd3056996299d217037ee0c7e1e0d57fd1b7476463b9bde2095f7d658d439",
      "output_excerpt": "Hit:1 https://download.docker.com/linux/ubuntu resolute InRelease\nHit:2 http://security.ubuntu.com/ubuntu resolute-security InRelease\nHit:3 http://archive.ubuntu.com/ubuntu resolute InRelease\nHit:4 http://archive.ubuntu.com/ubuntu resolute-updates InRelease\nHit:5 http://archive.ubuntu.com/ubuntu resolute-backports InRelease\nReading package lists...\nReading package lists...\nBuilding dependency tree"
    }
  ],
  "tool_versions": {
    "worktrunk": "0.80.0"
  },
  "observed_at_utc": "2026-10-05T04:20:01Z",
  "result": "pass",
  "claim": "NativeStack2604 worktrunk 0.80.0 installed through the existing destination plan and its supported upstream route.",
  "limitations": [
    "Installation is separate from native functionality, provider execution and unchanged upstream suite acceptance."
  ],
  "evidence_class": "native_proven",
  "reviews": [
    {
      "kind": "self",
      "ref": "scripts/host_receipts.py record",
      "verdict": "agree",
      "at_utc": "2026-10-05T04:20:01Z",
      "reviewer": {
        "identity_sha256": "02f447d7d8b8c35f8d8f004da0af082c266f2a7aea68a8ff08454896a486d178"
      }
    }
  ]
}
